word,part_of_speech,frequency,similarity,synonym,syn_frequency,syn_sim,author,age,book,year,sentence,modified,sentence_type
yore,noun,4.37e-07,0.9923984533555307,0.000229,,0.8130670260193493,Vladimir Nabokov,63,Pale Fire,1962,of the dim times of yore when Shade and he had,of the dim times of past when Shade and he had,Metaphor?
depart,verb,4.68e-06,0.9887657659336684,2.24e-05,,0.8695718704541427,Vladimir Nabokov,63,Pale Fire,1962,"saw Frank, the Shades' handyman, depart in the station wagon. I","saw Frank, the Shades' handyman, exiting in the station wagon. I",Metaphor?
ensconced,verb,2.82e-07,0.9858586156675399,2.51e-05,,0.8577370094006567,Vladimir Nabokov,63,Pale Fire,1962,"parked his car. I saw, ensconced in their tiny Pulex, manned","parked his car. I saw, settled in their tiny Pulex, manned",Metaphor?
dilapidated,adjective,1.12e-06,0.9916707832147517,0.00022,,0.8560300946963985,Vladimir Nabokov,63,Pale Fire,1962,"Kaplun, and his wife, a dilapidated eagle. I saw a Korean","Kaplun, and his wife, a run-down eagle. I saw a Korean",Metaphor?
ceremonial,adjective,3.09e-06,0.9772383115844182,2.82e-05,,0.8522808455321386,Vladimir Nabokov,63,Pale Fire,1962,"in the performance of their ceremonial duties, in light and shadow,","in the performance of their formal duties, in light and shadow,",Metaphor?
cruised,verb,6.46e-07,0.9899692145739797,1.62e-05,,0.8090929222095067,Vladimir Nabokov,63,Pale Fire,1962,"Martians the martinis and highballs cruised, the two white-coated youths from","Martians the martinis and highballs rolled, the two white-coated youths from",Metaphor?
youths,noun,4.07e-06,0.9903049394149567,0.000191,,0.8457421125023689,Vladimir Nabokov,63,Pale Fire,1962,"highballs cruised, the two white-coated youths from the hotel school, and","highballs cruised, the two white-coated kids from the hotel school, and",Metaphor?
slighter,adjective,6.31e-08,0.9765541045870995,0.000562,,0.86273628665068,Vladimir Nabokov,63,Pale Fire,1962,"knew well, quite well, the slighter of the two. And finally,","knew well, quite well, the little of the two. And finally,",Metaphor?
funereal,adjective,1.29e-07,0.9813105291271489,0.00011,,0.8065490341118164,Vladimir Nabokov,63,Pale Fire,1962,"limousine, officially glossy and rather funereal, glided into the aura of","limousine, officially glossy and rather dark, glided into the aura of",Metaphor?
glided,verb,2.95e-07,0.9752814929668889,1.62e-05,,0.8142796506542643,Vladimir Nabokov,63,Pale Fire,1962,"officially glossy and rather funereal, glided into the aura of the","officially glossy and rather funereal, rolled into the aura of the",Metaphor?
aura,noun,3.31e-06,0.9840613713261401,2.88e-05,,0.8078919159945142,Vladimir Nabokov,63,Pale Fire,1962,"rather funereal, glided into the aura of the drive, and while","rather funereal, glided into the atmospheres of the drive, and while",Metaphor?
grin,noun,3.89e-06,0.9955670416176481,4.37e-05,,0.9079244442362518,Vladimir Nabokov,63,Pale Fire,1962,in his buttonhole and a grin of welcome on his liquor-flushed,in his buttonhole and a smile of welcome on his liquor-flushed,Metaphor?
prettily,adverb,1.41e-07,0.9866470279460852,1.17e-05,,0.8886564149636477,Vladimir Nabokov,63,Pale Fire,1962,I crossed over with the prettily and reproachfully wrapped up carton.,I crossed over with the nicely and reproachfully wrapped up carton.,Metaphor?
pillar,noun,4.37e-06,0.977053839243101,1.05e-05,,0.8511979533617378,Vladimir Nabokov,63,Pale Fire,1962,"noticed a buchmann, a little pillar of library books which Sybil","noticed a buchmann, a little anchor of library books which Sybil",Metaphor?
